{
  "$schema": "https://json-schema.org/draft/2020-12/schema",
  "$id": "https://example.com/schemas/score_template.schema.json",
  "title": "Score Template",
  "type": "object",
  "required": ["st_meta", "buckets", "dimensions"],
  "properties": {
    "st_meta": {
      "type": "object",
      "required": ["key", "name", "schema_version", "scale"],
      "properties": {
        "key": { "type": "string", "minLength": 1 },
        "name": { "type": "string", "minLength": 1 },
        "schema_version": { "type": "string", "pattern": "^[0-9]+\\.[0-9]+\\.[0-9]+$" },
        "scale": {
          "type": "object",
          "required": ["min", "max"],
          "properties": {
            "min": { "type": "number", "const": 0 },
            "max": { "type": "number", "const": 100 }
          },
          "additionalProperties": false
        },
        "min_n": { "type": "integer", "minimum": 0 },
        "public_policy": {
          "type": "object",
          "properties": {
            "allow_public": { "type": "boolean" },
            "only_from": { "type": "string" },
            "min_orgs": { "type": "integer", "minimum": 1 }
          },
          "additionalProperties": false
        }
      },
      "additionalProperties": false
    },
    "buckets": {
      "type": "array",
      "minItems": 3,
      "items": {
        "type": "object",
        "required": ["code", "label", "color", "range"],
        "properties": {
          "code": { "type": "string", "enum": ["RED", "YELLOW", "GREEN"] },
          "label": { "type": "string" },
          "color": { "type": "string", "pattern": "^#([0-9a-fA-F]{6})$" },
          "range": {
            "type": "object",
            "required": ["min", "max"],
            "properties": {
              "min": { "type": "number", "minimum": 0, "maximum": 100 },
              "max": { "type": "number", "minimum": 0, "maximum": 100 }
            },
            "additionalProperties": false
          },
          "actions": { "type": "array", "items": { "type": "string" } },
          "feedback": { "type": "string" }
        },
        "additionalProperties": false
      }
    },
    "dimensions": {
      "type": "array",
      "minItems": 1,
      "items": {
        "type": "object",
        "required": ["code", "name", "weight", "items"],
        "properties": {
          "code": { "type": "string", "minLength": 1 },
          "name": { "type": "string", "minLength": 1 },
          "weight": { "type": "number", "exclusiveMinimum": 0, "maximum": 1 },
          "items": {
            "type": "array",
            "minItems": 1,
            "items": { "type": "string", "minLength": 1 },
            "uniqueItems": true
          },
          "transform": { "type": "string", "enum": ["avg*20", "scale_1to5", "custom"] },
          "bucket_overrides": {
            "type": "object",
            "properties": {
              "RED_MAX": { "type": "number", "minimum": 0, "maximum": 100 },
              "YELLOW_MAX": { "type": "number", "minimum": 0, "maximum": 100 }
            },
            "additionalProperties": false
          }
        },
        "additionalProperties": false
      }
    },
    "tips": {
      "type": "object",
      "patternProperties": {
        "^[A-Z0-9_]+$": {
          "type": "array",
          "items": { "type": "string" }
        }
      },
      "additionalProperties": false
    }
  },
  "additionalProperties": false
}
